{
  "pack": "snapshot",
  "country": "kr",
  "ticker": "005930.KS",
  "info": {
    "ticker": "005930.KS",
    "fetched_at": "2026-05-02T01:38:34Z",
    "_cache": "hit",
    "_warning": "yfinance is an unofficial scraper. DO NOT use for financial statements (income statement, balance sheet, cash flow). Use SEC EDGAR for financials.",
    "symbol": "005930.KS",
    "shortName": "SamsungElec",
    "longName": "Samsung Electronics Co., Ltd.",
    "sector": "Technology",
    "industry": "Consumer Electronics",
    "country": "South Korea",
    "currency": "KRW",
    "exchange": "KSC",
    "regularMarketPrice": 220500.0,
    "regularMarketPreviousClose": 226000.0,
    "marketCap": 1447927159455744,
    "enterpriseValue": 1373473230290944,
    "forwardPE": 5.4149647,
    "dividendYield": 1.03,
    "payoutRatio": 0.2526,
    "fiftyTwoWeekHigh": 230000.0,
    "fiftyTwoWeekLow": 53700.0,
    "fiftyDayAverage": 198901.0,
    "twoHundredDayAverage": 127987.75,
    "sharesOutstanding": 5764191903,
    "totalRevenue": 333605947572224,
    "grossMargins": 0.39379,
    "operatingMargins": 0.21322,
    "profitMargins": 0.13267,
    "returnOnEquity": 0.10783,
    "returnOnAssets": 0.0504,
    "totalDebt": 25239138336768,
    "totalCash": 125847113564160,
    "beta": 1.211,
    "_provenance": {
      "source": "yfinance (unofficial Yahoo Finance scraper)",
      "source_authority": "Yahoo Finance (unofficial, not endorsed)",
      "data_type": "unofficial_scraper",
      "update_cycle": "near-real-time (15 min delay)",
      "typical_lag": "15 minutes (price) / 1 day (fundamentals)",
      "fetched_at": "2026-05-02T01:38:34Z",
      "reference_period": null,
      "staleness_days": null
    }
  },
  "price_history": {
    "ticker": "005930.KS",
    "period": "1y",
    "interval": "1d",
    "fetched_at": "2026-05-02T01:39:59Z",
    "_cache": "miss",
    "data": [
      {
        "date": "2025-04-30",
        "open": 54931.1532,
        "high": 55029.42,
        "low": 54341.5523,
        "close": 54538.0859,
        "volume": 13014189
      },
      {
        "date": "2025-05-02",
        "open": 54046.7505,
        "high": 54538.0846,
        "low": 53260.616,
        "close": 53358.8828,
        "volume": 22454204
      },
      {
        "date": "2025-05-07",
        "open": 53555.4168,
        "high": 54046.7509,
        "low": 53358.8831,
        "close": 53653.6836,
        "volume": 17136991
      },
      {
        "date": "2025-05-08",
        "open": 54145.0177,
        "high": 54538.085,
        "low": 53555.4168,
        "close": 53653.6836,
        "volume": 16320532
      },
      {
        "date": "2025-05-09",
        "open": 53751.9519,
        "high": 54046.7524,
        "low": 53457.1515,
        "close": 53850.2188,
        "volume": 7814322
      }
    ],
    "latest_close": 220500.0,
    "latest_date": "2026-04-30",
    "rows": 5,
    "_provenance": {
      "source": "yfinance (unofficial Yahoo Finance scraper)",
      "source_authority": "Yahoo Finance (unofficial, not endorsed)",
      "data_type": "unofficial_scraper",
      "update_cycle": "near-real-time (15 min delay)",
      "typical_lag": "15 minutes (price) / 1 day (fundamentals)",
      "fetched_at": "2026-05-02T01:39:59Z",
      "reference_period": "2026-04-30",
      "staleness_days": 2
    }
  },
  "history": [
    {
      "date": "2025-04-30",
      "open": 54931.1532,
      "high": 55029.42,
      "low": 54341.5523,
      "close": 54538.0859,
      "volume": 13014189
    },
    {
      "date": "2025-05-02",
      "open": 54046.7505,
      "high": 54538.0846,
      "low": 53260.616,
      "close": 53358.8828,
      "volume": 22454204
    },
    {
      "date": "2025-05-07",
      "open": 53555.4168,
      "high": 54046.7509,
      "low": 53358.8831,
      "close": 53653.6836,
      "volume": 17136991
    },
    {
      "date": "2025-05-08",
      "open": 54145.0177,
      "high": 54538.085,
      "low": 53555.4168,
      "close": 53653.6836,
      "volume": 16320532
    },
    {
      "date": "2025-05-09",
      "open": 53751.9519,
      "high": 54046.7524,
      "low": 53457.1515,
      "close": 53850.2188,
      "volume": 7814322
    }
  ],
  "_provenance": {
    "tier": "Tier 2 (yfinance unofficial)",
    "primary_source_status": "deferred",
    "primary_source_note": "Korea has no primary-source equity client wired in data-kr yet. Tier A would be DART (전자공시시스템, dart.fss.or.kr) — integration deferred to a future minor version. Snapshot fields are yfinance-derived (Tier 2).",
    "exchange_suffix": "KS"
  },
  "_status": {
    "status": "ok",
    "market": "kr",
    "pack": "snapshot",
    "failed_sections": [],
    "warnings": []
  }
}
